{
  "$schema": "https://json-schema.org/draft/2020-12/schema",
  "$id": "https://github.com/SaschaAndresGrimm/ALBIS/blob/main/albis.config.schema.json",
  "title": "ALBIS configuration",
  "description": "Runtime configuration for ALBIS backend, launcher, and UI behavior.",
  "type": "object",
  "additionalProperties": false,
  "properties": {
    "server": {
      "type": "object",
      "additionalProperties": false,
      "properties": {
        "host": {
          "type": "string",
          "default": "127.0.0.1",
          "description": "Bind address for the backend server."
        },
        "port": {
          "type": "integer",
          "minimum": 0,
          "maximum": 65535,
          "default": 0,
          "description": "Bind port for the backend server. Set 0 to auto-select a free port at startup."
        },
        "reload": {
          "type": "boolean",
          "default": false,
          "description": "Enable auto-reload in source mode."
        },
        "allowed_hosts": {
          "type": "array",
          "items": { "type": "string" },
          "default": [],
          "description": "Host header names ALBIS will answer to, in addition to localhost. Leave empty to derive them from server.host: a loopback bind accepts only this machine, and a 0.0.0.0 bind accepts any IP address plus this machine's own hostnames. Set this when clients reach ALBIS under a name it cannot derive, such as a reverse proxy hostname or a container alias. Use [\"*\"] to accept any host, which turns the DNS-rebinding check off."
        },
        "compression": {
          "type": "string",
          "enum": ["auto", "on", "off"],
          "default": "auto",
          "description": "Compress responses for remote clients, preferring zstd and falling back to gzip based on what the client accepts. 'auto' compresses for every client except loopback, so local desktop use pays nothing. Use 'on' behind a reverse proxy, where the proxy is the client and every request looks like loopback. 'off' disables compression."
        }
      }
    },
    "launcher": {
      "type": "object",
      "additionalProperties": false,
      "properties": {
        "startup_timeout_sec": {
          "type": "number",
          "exclusiveMinimum": 0,
          "default": 10.0,
          "description": "Seconds to wait for backend startup before warning."
        },
        "startup_health_timeout_sec": {
          "type": "number",
          "minimum": 0.1,
          "default": 15.0,
          "description": "Seconds to wait for the backend health endpoint to answer at startup."
        },
        "open_browser": {
          "type": "boolean",
          "default": true,
          "description": "Open the browser automatically after launch."
        },
        "debug_macos_events": {
          "type": "boolean",
          "default": false,
          "description": "Enable verbose macOS app-event logging in the launcher."
        },
        "idle_shutdown_min": {
          "type": "integer",
          "minimum": 0,
          "maximum": 1440,
          "default": 15,
          "description": "Stop ALBIS once no tab has been open for this many minutes (0: never). Only for a server started by the launcher on this computer."
        }
      }
    },
    "data": {
      "type": "object",
      "additionalProperties": false,
      "properties": {
        "root": {
          "type": "string",
          "default": "",
          "description": "Data root directory. Empty selects runtime defaults."
        },
        "allow_abs_paths": {
          "type": "boolean",
          "default": true,
          "description": "Allow absolute file/folder paths in API calls."
        },
        "scan_cache_sec": {
          "type": "number",
          "minimum": 0,
          "default": 2.0,
          "description": "Folder/file scan cache lifetime in seconds."
        },
        "max_scan_depth": {
          "type": "integer",
          "minimum": -1,
          "default": -1,
          "description": "Maximum recursive scan depth for folder discovery. -1 means unlimited, which is bounded in practice by max_scan_entries and max_scan_seconds."
        },
        "max_scan_entries": {
          "type": "integer",
          "minimum": 0,
          "default": 200000,
          "description": "Maximum directory entries a single scan may visit. 0 means unlimited. A scan that reaches the limit stops and reports itself as truncated."
        },
        "max_scan_seconds": {
          "type": "number",
          "minimum": 0,
          "default": 5.0,
          "description": "Wall-clock budget in seconds for a single scan. 0 means unlimited. A scan that reaches the limit stops and reports itself as truncated."
        },
        "max_upload_mb": {
          "type": "integer",
          "minimum": 0,
          "default": 0,
          "description": "Upload size limit in megabytes. 0 disables explicit limit."
        }
      }
    },
    "logging": {
      "type": "object",
      "additionalProperties": false,
      "properties": {
        "level": {
          "type": "string",
          "enum": [
            "DEBUG",
            "INFO",
            "WARNING",
            "ERROR",
            "CRITICAL"
          ],
          "default": "INFO",
          "description": "Backend log level."
        },
        "dir": {
          "type": "string",
          "default": "",
          "description": "Log directory path. Empty resolves to <data.root>/logs in source mode and ~/.config/albis/logs in packaged mode."
        }
      }
    },
    "ui": {
      "type": "object",
      "additionalProperties": false,
      "properties": {
        "tool_hints": {
          "type": "boolean",
          "default": false,
          "description": "Enable additional tool-hint text in the UI."
        },
        "auto_check_updates": {
          "type": "boolean",
          "default": true,
          "description": "Check for ALBIS updates on frontend startup and notify when a newer version is available."
        },
        "allow_update_download": {
          "type": "boolean",
          "default": true,
          "description": "Allow the update dialog to download the matching release asset and verify it against the release's SHA256SUMS.txt. Set false to keep the dialog to a link only, so ALBIS never writes a downloaded installer to disk."
        },
        "allow_update_apply": {
          "type": "boolean",
          "default": false,
          "description": "Allow the update dialog to apply a verified download and close ALBIS. Off by default. Only ever acts on a Linux AppImage (replaced in place) or the Windows installer (run silently), only on a download whose checksum verified, and never while a live watch, series sum or export is running."
        },
        "pixel_label_min_cell_px": {
          "type": "integer",
          "minimum": 8,
          "maximum": 64,
          "default": 18,
          "description": "Minimum on-screen cell size for rendering pixel labels."
        },
        "pixel_label_max_labels": {
          "type": "integer",
          "minimum": 100,
          "maximum": 100000,
          "default": 4000,
          "description": "Upper bound for rendered pixel labels per frame."
        },
        "frame_cache_mb": {
          "type": "integer",
          "minimum": 0,
          "maximum": 4096,
          "default": 256,
          "description": "Memory budget in MB for caching recently viewed frames, so revisiting one costs no transfer. Budgeted in memory rather than in frames because a frame is about 4 MB on an EIGER 1M and about 18 MB on a 4M detector. Set 0 to disable caching."
        },
        "pixel_label_format": {
          "type": "string",
          "enum": [
            "auto",
            "integer",
            "scientific"
          ],
          "default": "auto",
          "description": "Pixel-label number format."
        },
        "pixel_label_show_during_drag": {
          "type": "boolean",
          "default": false,
          "description": "Render pixel labels while panning/dragging."
        },
        "detector_control": {
          "type": "boolean",
          "default": false,
          "description": "Beta: show the Detector tab, which controls a DECTRIS detector over the SIMPLON API."
        },
        "hidden_tools": {
          "type": "array",
          "items": { "type": "string", "enum": ["rings", "peaks", "flatfield", "inpainting", "combine"] },
          "default": [],
          "description": "Analysis tools to leave out of the Analysis tab: rings (Resolution Rings), peaks (Peak Finder), flatfield, inpainting, combine (Combine Frames). A hidden tool is switched off. Statistics and ROI is always shown. Also set in Settings -> Tools."
        },
        "known_detectors_file": {
          "type": "string",
          "default": "",
          "description": "Where the shared list of known detectors is kept. Empty: ~/.config/albis/known_detectors.json. A relative path is taken from this file's folder."
        },
        "language": {
          "type": "string",
          "enum": [
            "en",
            "zh-CN",
            "ja",
            "fr",
            "es",
            "it",
            "pt",
            "rm",
            "de",
            "sv",
            "da",
            "mi",
            "gsw"
          ],
          "default": "en",
          "description": "UI language for frontend labels and messages."
        }
      }
    }
  },
  "default": {
    "server": {
      "host": "127.0.0.1",
      "port": 0,
      "reload": false,
      "compression": "auto",
      "allowed_hosts": []
    },
    "launcher": {
      "startup_timeout_sec": 5.0,
      "open_browser": true,
      "debug_macos_events": false,
      "idle_shutdown_min": 15
    },
    "data": {
      "root": "",
      "allow_abs_paths": true,
      "scan_cache_sec": 2.0,
      "max_scan_depth": -1,
      "max_upload_mb": 0
    },
    "logging": {
      "level": "INFO",
      "dir": ""
    },
    "ui": {
      "tool_hints": false,
      "auto_check_updates": true,
      "allow_update_download": true,
      "allow_update_apply": false,
      "pixel_label_min_cell_px": 18,
      "pixel_label_max_labels": 4000,
      "frame_cache_mb": 256,
      "pixel_label_format": "auto",
      "pixel_label_show_during_drag": false,
      "language": "en",
      "detector_control": false,
      "hidden_tools": [],
      "known_detectors_file": ""
    }
  }
}
